commit	local_score	dacon_score	status	description
076dd36	454		discard	RandomForest baseline (Dacon 제공, median impute) — 즉시 교체됨
92e20dd	722.50	848.64484	keep	LightGBM + 23개 피처 엔지니어링(카운트/레버리지/매치업/cold-start/구종성향/주기성) + isotonic 보정
23c711c	748.36	881.22099	keep	LightGBM+CatBoost 50:50 블렌드 + isotonic 보정 (2022/2023/2024 롤링 검증으로 하이퍼파라미터 재확인, 학습데이터 최신성이 튜닝보다 중요함을 확인)
69d16f1	770.19		discard	trackman_history.csv 카운트 상황(balls/strikes/outs_before) lookup 피처 12개 추가 — PR #3에 GPT Pro 리뷰 요청, TK_LOOKUP이 season 필터 없이 2019~2024 전체로 만들어져 2024 홀드아웃 검증에 2024 자체 Trackman 정보가 새어든 결함 발견 (실제 2025 제출 경로는 안전, 검증 수치만 무효)
90cfa5c	765.86		discard	TK_LOOKUP을 TK_LOOKUP_VAL(시즌<=2023, 검증용)/TK_LOOKUP_FULL(시즌<=2024, 최종 제출용)로 분리해 season 리크 수정, merge에 validate="many_to_one" 추가 — 재검증한 정직한 점수 748.36->765.86. GPT Pro 재리뷰에서 merge key dtype 방어 부재 + 세 build_features() 문자 불일치 지적받아 223c29d로 보완
223c29d	765.86		discard	merge 전 tk_lookup 키 dtype을 df 쪽에 맞춰 캐스팅, train.ipynb의 ID->ID_COL 상수명 통일 + docstring 일치로 train/inference/script.py의 build_features() 3곳을 완전히 동일화(diff로 확인) — 점수는 765.86 그대로. 3차 재리뷰에서 CatBoost best_iteration off-by-one 버그 새로 발견되어 4876feb로 수정
4876feb	766.04	882.108625189	keep	CatBoostClassifier.get_best_iteration()이 0-based 인덱스인데 그대로 iterations=에 넘겨 실제 선택된 모델보다 트리 1개 적게 재현되던 버그 수정(+1 보정, 토이 예제로 직접 검증) — v2부터 있던 일반 버그였음. 766.04로 소폭 개선. 4차 GPT Pro 재리뷰에서 이 수정 자체는 통과 확인, isotonic 보정 OOF가 random KFold+asof_* 시간누적피처로 완전한 시간순은 아니라는 새 지적은 v1부터 있던 기존 설계이자 대회 규칙 위반은 아니라고 판단해 이슈 #4로 분리, PR #3은 여기서 마무리. Dacon 리더보드 제출 완료: 882.108625189 (v2 881.22099 대비 +0.89)
8c80e65	748.08	871.3183926356	keep	이슈 #4 수정: isotonic 보정 OOF를 KFold(shuffle=True) 무작위 분할에서 시즌 단위 expanding-window(season<Y로 학습, Y를 OOF)로 재설계, global_mean/tk_lookup도 fold별 재계산. 재검증한 정직한 점수 766.04->748.08. 트랙맨 피처 ablation(동일 방법론): 없음 727.83 vs 있음 748.08(+20.25) — v3의 상대적 개선폭 재확인, 낙폭은 방법론 편향 제거일 뿐 트랙맨 무효화 아님. PR #5 merged. 2026-08-23 Dacon 제출(v4 단독, 50:50 고정블렌드): 871.32 — v3(882.11) 대비 -10.79로 하락폭 대부분이 여기서 발생. v5(876.93)는 v4+가중치탐색인데 v4보다 오히려 +5.61 높음 -> 가중치 탐색이 OOF 재설계의 악영향을 상당부분 상쇄한 것으로 보임. v6(871.37)는 v4와 사실상 동일(-0.05) -> NN 추가가 v5의 가중치탐색 이득을 거의 정확히 상쇄. 결론: (1) expanding-window OOF 재설계 자체가 실제 일반화에 -10~11점 수준의 해를 끼침(원인 미확정, 조사 필요), (2) v5 가중치 탐색은 이를 우연히 상쇄했을 뿐일 가능성 있음(2024 홀드아웃 과적합 우려, GPT Pro도 model-selection bias 지적), (3) v6의 NN은 로컬 ablation(+5.19)과 반대로 실제 성능을 깎음 -> PR #7 머지 보류 유지
same_hand실험	749.34		discard	(중간 실험, 별도 커밋 아님) 트랙맨 lookup 키에 same_hand 매치업 추가 + w=0.35 블렌드 -> 749.34였지만, 같은 w/순서로 고정한 ablation에서 same_hand 없이는 750.75로 더 높게 나와 -1.41 악화임이 드러나 기각/되돌림
5d77c5a	750.75	876.9277353124	keep	블렌드 가중치를 고정 50:50 대신 W_GRID(0.10~0.90) 격자 탐색 -> w_lgb=0.35 최적, 748.08->750.75. 보정 순서(블렌드후보정 vs 모델별보정후블렌드) 비교 -> 블렌드후보정이 전 실험에서 우세, 기존 방식 유지 확인(calibration_mode 필드로 일반화). same_hand 트랙맨 키 확장은 ablation 결과 기각. 2026-08-22 Dacon 제출: 876.93 — v3(882.11) 대비 -5.18 하락, 로컬 검증(748.08->750.75 개선)과 반대 방향. v4의 expanding-window OOF 재설계가 원인일 가능성 있음(v5는 v4+가중치튜닝뿐) — v4 단독 제출로 조사 예정(2026-08-23)
afc24ea	757.28		discard	PyTorch MLP를 세 번째 앙상블 모델로 추가 — 최초 버전. GPT Pro PR #7 코드 리뷰에서 train_nn()이 조기종료 break epoch(13)를 반환하고 실제 best epoch(9)를 반환하지 않는 버그 발견(CatBoost off-by-one과 같은 성격) — OOF/최종 재학습이 검증에 쓰인 모델과 다른 epoch 수로 학습돼 757.28/+6.53이 부풀려진 수치였음. 다음 커밋에서 수정 후 재검증.
OOF보정실험	766.04(A)/757.06(B1)/733.29(B2)/749.33(C)		실험중	(중간 실험, 별도 커밋 아님) 2024 홀드아웃 원인조사: 보정 OOF 방식 A/B/C 3갈래 병렬 비교. A=KFold(shuffle) 복원(pre-issue#4 방식 그대로) -> 766.04(+15.29, v3 로컬점수 766.04와 정확히 일치). B1=expanding-window에서 season=2020 fold만 제외 -> 757.06(+6.31). B2=2020+2021 fold 제외 -> 733.29(-17.46, 악화). C=fold train_size 비례 가중 isotonic -> 749.33(거의 변화없음). 결론: KFold(shuffle) 복원이 로컬 최고점이자 실제 최고 실측점(v3, 882.11)과도 일치 -> 보정 메커니즘만 KFold로 되돌리는 v7 실험 권장, 사용자 판단 대기
461a374	755.94	871.3702762474	keep	GPT Pro PR #7 코드 리뷰 반영: train_nn()의 NN_EPOCHS 버그(조기종료 break epoch를 반환, best epoch 아님) 수정 후 전체 파이프라인 재생성 -> 750.75 vs 755.94, +5.19로 여전히 채택(로컬 기준). CAT_VOCABS 전체데이터 어휘 안전성을 assert로 검증. 신경망 아티팩트를 nn.Module 전체 pickle에서 state_dict+재구성메타데이터로 전환(cross-version pickle 위험 제거). 블렌드 가중치 선택의 model-selection bias 한계 문서화. 2026-08-22 Dacon 제출: 871.37 — v5(876.93) 대비 -5.56, v3(882.11) 대비 -10.74 하락. 로컬 검증은 v5보다 개선(750.75->755.94)이라 나왔는데 실제로는 더 나빠짐 — 로컬 재검증 방법론(expanding-window OOF)이 실제 2025 데이터 일반화를 못 따라가고 있을 가능성. PR #7 머지 보류, 원인 조사 중
cc146f6	766.04	882.1086251899	keep	v7: 보정(calibration) OOF 생성 메커니즘을 expanding-window에서 KFold(shuffle=True, n_splits=5, random_state=42)로 되돌림(main/v5 기준 브랜치, v6/NN 미포함). 이번 세션 로컬 A/B/C 실험(위 "OOF보정실험" 행 참고)에서 KFold 복원(A)이 로컬 최고점(766.04, v5 기준 750.75 대비 +15.29)이자 v3 원래 로컬 점수와 정확히 일치, 실제 리더보드에서도 KFold 기반 v3(882.11)가 지금까지 최고 실측점이었음을 근거로 채택. TK_LOOKUP_VAL/TK_LOOKUP_FULL 시즌분리·build_features()·블렌드가중치탐색 인프라는 무변경(diff로 확인), inference.ipynb/script.py도 아티팩트 스키마 불변이라 무수정. 재실행 결과 로컬 766.04 재현(w_lgb=0.50, blend_then_calibrate 선택), 245,789행 스트레스 테스트 1.87초로 통과. 2026-08-23 Dacon 제출: 882.1086251899 — v3(882.108625189)와 사실상 동일(소수점 마지막 자리 반올림 차이뿐). 가설 완전 확정: expanding-window OOF 보정 방식(issue #4/v4~v6)이 실측 -10~11점 하락의 유일한 원인이었고, KFold(shuffle) 복원만으로 v3 수준 완전 회복. PR #8 머지 가능, PR #7(NN)은 이 새 KFold 기준선 위에서 ablation 재실행 필요
19725c1	774.07	895.4429039277	keep	v8-li: main(5a68620=v7 기준)에서 독립 분기, build_features()에 li(leverage index) 파생 피처 3개 추가 — is_high_leverage(li>=1.5, train.csv 실제 분포 확인: 평균0.98/중앙값0.80/li>=1.5가 상위19.7%), li_count_diff(li*count_diff), li_late_close(li*late_and_close). 필수 ablation(동일 KFold(shuffle=True,5-fold) OOF+블렌드가중치/순서 격자탐색, 2024 홀드아웃): li 없음 766.04 vs 있음 774.07, +8.03 개선(same_hand -1.41과 뚜렷이 다른 방향) -> 채택. 최적 (order,w_lgb)이 blend_then_calibrate/0.50 -> calibrate_then_blend/0.45로 변경됨. build_features() 3파일(train.ipynb/inference.ipynb/script.py) 문자단위 동일성 diff로 확인. submissions/v8_li_leverage.zip 빌드 완료, 5행+245,789행 스트레스 테스트(1.6초) 통과. 세 v8 백로그 항목(NN/li/시즌워크로드) 모두 main에서 독립 분기, 서로 stacking 안 함. 2026-08-24 Dacon 제출: 895.4429039277 — v7(882.11) 대비 +13.33, 로컬 개선폭(+8.03)보다도 실측 개선폭이 더 큼(로컬-실측 방향 완전 일치) -> PR #9 머지 확정
6d293ff	780.65	871.0776063178	keep(머지보류, 원인조사중)	v8-season: main(5a68620=v7 기준)에서 독립 분기, asof_pitcher_n(커리어 누적)에서 투수별 "시즌 시작 시점" baseline을 뺀 season_pitch_load_est + pitcher_season_load_cold_start 2개 피처 추가. baseline은 make_pitcher_load_baseline()으로 계산 — 시즌별 종료시점 누적치를 투수 단위 정렬 후 shift(1)해 "그 시즌보다 엄격히 이전 시즌"만 반영하도록 구조적으로 보장(같은시즌 self-min 방식은 검증대상/2025 test.csv 자체가 train.csv에 없어 구조적으로 불가능해서 기각), TK_LOOKUP과 동일한 검증(≤2023)/최종(≤2024) 분리도 이중 안전장치로 유지. 2019~2024 이력 없는 투수(2025 신인/콜업)는 baseline 0 + cold-start 플래그(진짜 데뷔 투수는 이번시즌 던진 만큼이 곧 워크로드이므로 의미상 올바른 값). 필수 ablation(동일 kfold_oof()+블렌드가중치/순서 격자탐색, 2024 홀드아웃): 없음 766.04 vs 있음 780.65, +14.61 개선 — v8 백로그 3항목(NN/li/시즌워크로드) 중 최대폭이자 프로젝트 전체 단일피처군 추가로도 최대폭(트랙맨+20.25, li+8.03 대비). 최적 (order,w_lgb)이 blend_then_calibrate/0.50 -> calibrate_then_blend/0.40으로 변경. 문헌근거(급성피로 O, 만성시즌워크로드 X)가 가장 약한 항목이었는데 결과는 반대로 가장 컸음 — "문헌근거 강약과 실측 효과크기가 비례하지 않는다"는 사례로 기록. 콜드스타트 비율(2024 시즌행 기준) 19.86%(투수수 기준 81/391=20.72%) — 실제 2025 test.csv 콜드스타트 근사치. build_features() 3파일 문자단위 동일성 확인. submissions/v8_season_load.zip 빌드+5행/245,789행 스트레스테스트(2.65초) 통과. 2026-08-24 Dacon 제출: 871.0776063178 — v7(882.11) 대비 -11.03 하락, 로컬 개선(+14.61)과 정반대 방향 — v4~v6 시기의 "로컬 개선/실측 악화" 패턴이 이 피처에서 재발. KFold 보정 복원(v7)으로 해결됐다고 확인한 문제가 재발했다는 건 방법론이 아니라 이 피처(시즌시작 baseline lookup) 자체의 문제 가능성 시사 — 가설: (1) baseline lookup의 미확인 리크 경로, (2) 2024 홀드아웃과 실제 2025 test.csv 간 콜드스타트비율/투수풀 차이, (3) 이 변형에서 선택된 가중치(calibrate_then_blend/0.40)가 2024 홀드아웃에 과적합(v8-nn실험이 발견한 홀드아웃 최대화 가중치선택의 과적합 위험과 동일 계열). PR #10 머지 보류, 원인 조사 필요
v8-nn실험	771.82(①편향)/753.48(②독립)		discard	v8: v6의 PyTorch MLP를 v7 KFold 기준선 위에서 재검증 -> 기각. kfold_oof()를 3-way(LGB/CB/NN)로 확장(NN도 같은 5-fold 안에서 학습, fit_scaler는 fold별 재적합), 가중치 탐색도 (w_lgb,w_cb,w_nn) 합=1 0.1간격 3-way로 확장. ablation①(2024에서 가중치까지 선택): LGB+CB 766.04 vs +NN 771.82(+5.78) — 그러나 3-way 격자가 2-way 격자를 부분집합으로 포함하므로 이 diff는 정의상 음수가 될 수 없음(개선이 아니라 탐색 자유도를 측정). ablation②(선택편향 제거: 가중치는 OOF 1.22M행 원시블렌드 Brier로만 선택, 2024는 평가 전용): 2-way w=(0.9,0.1) -> 753.48, 3-way w=(0.9,0.1,0.0) -> 753.48, diff +0.00 — **3-way 탐색이 스스로 NN에 가중치 0.0을 부여**(w_nn>0인 66개 조합 중 OOF Brier가 w_nn=0보다 나은 것이 하나도 없음). 따라서 ①의 +5.78은 격자 확장에 따른 2024 홀드아웃 과적합으로 판정, same_hand(v5, -1.41) 전례와 동일 규율로 코드 전부 원복(문서만 커밋). 실측과 일치: v6 로컬 +5.19가 실제 리더보드에서 0으로 사라졌던 현상(v6 871.37 vs NN없는 v4 871.32)을 이번엔 제출 전에 로컬에서 포착. NN 단독 625.65 (LGB 720.40 / CB 724.12). 교훈: 후보공간이 기준선의 상위집합인 ablation은 게이트가 아니다 — 선택에 쓰지 않은 데이터로 평가하는 게이트를 반드시 병행할 것.
season워크로드원인규명	766.04(without,biased)/780.65(with,biased)/753.48(without,unbiased)/754.42(with,unbiased)		resolved(PR#10기각)	PR #10 실측역전(-11.03) 원인 규명 완료. v8-nn실험(위 행)에서 확립한 "OOF만으로 가중치/보정순서 선택, 홀드아웃은 평가 전용" 게이트를 이 피처에도 그대로 적용 — experiment/v8-season-workload의 build_features()/kfold_oof()를 문자단위로 그대로 재현한 독립 스크립트로 without/with 두 설정을 처음부터 재학습(LGB+CB 재적합 + 5-fold KFold OOF 재생성, 총 11.8분). ①기존 방식(2024 홀드아웃에서 직접 최댓값 선택): without 766.04(blend_then_calibrate/w=0.50) vs with 780.65(calibrate_then_blend/w=0.40) — diff +14.60, 원래 채택 근거였던 +14.61과 거의 정확히 일치해 재현 스크립트 자체의 정확성부터 확인됨. ②독립 게이트(가중치는 1.22M행 OOF 원시 블렌드 Brier로만 선택, order=blend_then_calibrate 고정, 2024는 평가에만 사용): without 753.48(w=0.90) vs with 754.42(w=0.90) — diff +0.94, 노이즈 수준으로 거의 소멸. 즉 로컬 +14.61의 93%(13.66점)가 "이 피처를 추가하면 그리드 서치가 2024 홀드아웃의 특정 노이즈에 더 잘 맞는 조합(calibrate_then_blend/w=0.40)을 우연히 찾아낼 수 있었다"는 순수 홀드아웃 과적합이었고, 진짜 일반화 신호는 +0.94뿐이었음 — 진짜 효과가 0에 가까운 피처는 2024/2025라는 서로 다른 시즌의 노이즈만으로도 쉽게 부호가 뒤집힐 수 있으므로, 실측 -11.03과 완전히 부합하는 설명. 부수 확인(가설1/2): make_pitcher_load_baseline()의 shift(1) 공식 자체는 리크 없음 재확인 (career-fallback 경로 값 분포가 per_season 경로 값 분포와 통계적으로 유사, season_pitch_load_est는 asof_pitcher_n의 시즌 간 누적 드리프트를 의도대로 상쇄해 연도별로 안정적/정상적 — 계산 버그 아님). 다만 시즌별 "완전 신규 투수" 비율은 13.80%(2023)~30.90%(2020)로 해마다 변동이 커서(2024=20.72%), 2025의 실제 콜드스타트 구성이 2024와 다를 위험(가설2)은 국지적으로 배제되지 않으나, 가설3만으로도 -13.6점 규모의 로컬 과대평가가 이미 설명되므로 주원인으로 특정하지 않음. 결론: PR #10 기각 확정, same_hand(v5)/v8-nn(v8-nn) 전례와 동일 규율로 코드 미채택 유지(브랜치는 문서·재현스크립트 참고용으로 보존). 프로젝트 전체 교훈: "홀드아웃에서 직접 그리드서치 최댓값을 고르는 가중치/보정순서 선택은 과적합 위험이 크다"는 v8-nn실험에 이어 두 번째로 독립 확증됨 — 리스크는 모델-포함 여부(상위집합 격자, v8-nn)뿐 아니라 피처-포함 여부(동일 크기 격자, 이번 건)에도 동일하게 적용됨. v7(882.11)/li(895.44)는 이미 실측으로 확정된 채택 상태라 재검증 대상 아님(다만 v5/v7 자체의 블렌드 가중치도 같은 방식으로 선택됐다는 점은 낮은 우선순위 후속 과제로 memory에 이미 기록돼 있음).
v9-middle-trend실험	774.07(without,biased)/764.89(with,biased)/761.61(without,unbiased)/737.88(with,unbiased)		discard	experiment/v9-middle-trend: build_features()에 pitcher_middle_trend(=asof_pitcher_prev1_game_middle_rate - asof_pitcher_prev5_game_middle_rate)/pitcher_middle_trend3(prev3-prev5) 2개 추가 시도 — 기존 pitcher_recent_trend/pitcher_recent_trend3(success_rate 버전)과 동일 패턴을 middle_rate 계열에 적용. PR #10(시즌워크로드) 사건 이후 도입된 이중게이트 절차를 처음부터 적용: 독립 진단 스크립트(docs/middle_trend_unbiased_gate_diagnostic.py, main 5a68620/v8-li 기준 build_features()를 문자단위로 재현)로 without/with 재학습(LGB+CB 재적합 + 5-fold KFold OOF, 총 19.8분). (A)기존방식(2024 홀드아웃 직접 최댓값 선택): without 774.07(calibrate_then_blend/w=0.45) vs with 764.89(blend_then_calibrate/w=0.40) — diff -9.18. (B)독립게이트(가중치는 OOF 원시 블렌드 Brier로만 선택, order=blend_then_calibrate 고정, 2024는 평가 전용): without 761.61(w=0.75) vs with 737.88(w=0.90) — diff -23.73. 두 게이트 모두 뚜렷한 음수로, season-workload 사례((A)+14.61인데 (B)+0.94로 소멸)와 달리 (A)조차 이미 악화라 애매함의 여지가 없음. solo 모델 점수도 둘 다 크게 하락(LGB 720.59->709.79, CB 740.89->720.42) — 가중치선택 편향이 아니라 피처 자체가 개별모델 성능을 깎는다는 뜻. 가설: middle_rate 기저율(~15%)이 success_rate(~52%)보다 훨씬 희소해 prev1/3/5 차분이 신호보다 노이즈에 가깝고, 기존 matchup_middle_diff와 부분 중복돼 분산만 키움(원인 확정은 범위 밖). 결론: 기각 확정. same_hand(v5)/v8-nn 전례와 동일 규율로 코드를 build_features() 3파일(train.ipynb/inference.ipynb/script.py) 어디에도 반영하지 않음(main과 문자단위 동일, diff 없음) — 진단 스크립트 단계에서 걸러져 노트북 재실행/제출 zip 빌드/Dacon 제출 자체가 불필요했음. README.md에 "v9" 절 + 실험이력 표 행 추가, 브랜치 push, PR 없음(v8-nn 전례와 동일 — 머지할 코드가 없음).
21	v9-reverse-rate실험	774.07(without,biased)/771.87(with,biased)/761.61(without,unbiased)/745.51(with,unbiased)		discard	experiment/v9-reverse-rate: build_features()에 asof_pitcher_reverse_rate("이 투구 직전까지 이 투수의 의도 반대성 투구 비율", 대회 라벨의 공식 실패조건 중 하나인 "포수 요구 방향과 반대" 개념과 가장 가까운 원본 컬럼) 파생 3개 추가 시도 — pitcher_reverse_rate_smooth(=shrink(asof_pitcher_reverse_rate, asof_pitcher_n, k=30), 기존 pitcher_success_rate_smooth와 동일 패턴), reverse_rate_li(=smooth*li, 고레버리지에서 반대투구 성향 스파이크 가설), reverse_rate_full_count(=smooth*is_full_count, 풀카운트 압박 가설). PR #10 이후 도입된 이중게이트 절차를 처음부터 적용: 독립 진단 스크립트(docs/reverse_rate_unbiased_gate_diagnostic.py, main eea05e5/v8-li 기준 build_features()를 문자단위로 재현)로 without/with 재학습(LGB+CB 재적합 + 5-fold KFold OOF, 총 21.4분). (A)기존방식(2024 홀드아웃 직접 최댓값 선택): without 774.07(calibrate_then_blend/w=0.45) vs with 771.87(calibrate_then_blend/w=0.40) — diff -2.20. (B)독립게이트(가중치는 OOF 원시 블렌드 Brier로만 선택, order=blend_then_calibrate 고정, 2024는 평가 전용): without 761.61(w=0.75) vs with 745.51(w=0.90) — diff -16.09. 두 게이트 모두 음수 — season-workload 사례((A)+14.61인데 (B)+0.94로 소멸)보다도 신호 부재가 더 명확한 케이스, (A)조차 처음부터 음수라 애매함의 여지가 없음. solo 모델 점수도 둘 다 하락(LGB 720.59->708.18, CB 740.89->737.98). 원본 asof_pitcher_reverse_rate 컬럼 자체는 이미 FEATURES에 포함돼 모델이 직접 학습 중이므로, 이 결과는 "smooth/li/full_count 파생이 추가 신호를 못 준다"는 뜻이지 원본 컬럼의 유용성을 부정하는 것은 아님. 결론: 기각 확정. same_hand(v5)/v8-nn/v9-middle-trend 전례와 동일 규율로 코드를 build_features() 3파일(train.ipynb/inference.ipynb/script.py) 어디에도 반영하지 않음(main과 문자단위 동일) — 진단 스크립트 단계에서 걸러져 노트북 재실행/제출 zip 빌드/Dacon 제출 자체가 불필요했음. README.md에 "v9" 절 + 실험이력 표 행 추가, CLAUDE.md에 기각 요약 추가, docs/reverse_rate_unbiased_gate_diagnostic.py 커밋, 브랜치 push, PR 없음(머지할 코드가 없음).
deaf54f	774.07(biased)/761.61(unbiased)	879.1639168871	discard(PR#11 close)	v9-oof-default-weight: main(eea05e5=v7+li) 기준, 피처 변경 없음. notebooks/train.ipynb 섹션 6/7의 블렌드가중치/보정순서 기본 선택 방식을 홀드아웃 직접 최대화(search_df.loc[idxmax()], biased)에서 KFold(shuffle=True,5-fold) OOF 원시 블렌드 Brier만 사용(order=blend_then_calibrate 고정, 홀드아웃은 평가 전용, unbiased)으로 전환 — PR #10(시즌워크로드) 실측역전 사건에서 확립된 진단 절차(season_load_unbiased_gate_diagnostic.py)를 진단 도구에서 파이프라인 기본값으로 승격. build_features()/kfold_oof()는 main과 문자단위 동일(diff 없음), inference.ipynb/script.py도 아티팩트 스키마 불변이라 무수정(diff 없음). 로컬 2024 홀드아웃: biased 774.07(calibrate_then_blend/w=0.45) vs unbiased 761.61(blend_then_calibrate/w=0.75), -12.46 — v9-middle-trend/v9-reverse-rate 진단에서 독립 재현된 동일 기준선(774.07/761.61)과 정확히 일치해 재현성 확인됨. 이 로컬 하락 자체는 unbiased 절차가 실측에서 더 낫다는 근거도 나쁘다는 근거도 아님(이슈#4/PR#10에서 이미 두 번 로컬-실측 반대방향 확인됨) — 판단은 Dacon 재제출 실측 점수로만. submissions/v9_oof_weight.zip 빌드, 5행+245,789행(1.73초) 스트레스테스트 통과. 브랜치 push, PR 오픈 예정, 채택/기각 보류(현재 실측 확정 기준선: li/biased 895.4429039277).
 [실측반영 2026-08-25] Dacon 제출: 879.1639168871 — li(895.44) 대비 -16.28, 심지어 li 없는 v7(882.11)보다도 낮음. 로컬(-12.46)과 방향 일치 — 이번엔 로컬/실측이 서로를 뒷받침해 "홀드아웃 직접 최대화가 OOF-only 선택보다 나쁠 것"이라는 가설이 이 피처셋(li 포함)에서는 실측으로 기각됨. 언바이어스 게이트는 피처 채택/기각 판정 도구(시즌워크로드 사례)로는 유효하나, 파이프라인 기본 가중치 선택 방식 자체를 대체하는 용도로는 부적합함이 확인됨 — main은 기존 방식(홀드아웃 직접 최대화) 유지. PR #11 close(머지 안 함).
v9-count-lean실험	774.07(without,biased)/757.25(with,biased)/761.61(without,unbiased)/744.49(with,unbiased)		discard	experiment/v9-pitcher-count-lean: build_features()에 pitcher_count_lean(=투수x(balls_before,strikes_before) 셀의 smoothed control_success 평균 - pitcher_success_rate_smooth, xCTRL 문헌근거의 "투수 자기 평소 대비 카운트별 이탈도") 1개 추가 시도. train.csv 자기 자신의 target을 (pitcher_id, count)로 집계하는 첫 사례라 기존 tk_lookup류(별도 파일 집계)보다 훨씬 직접적인 리크 경로 -> 두 갈래 leak-safe 설계: (1) X_train(모델이 직접 fit)은 kfold_oof()가 나중에 쓸 것과 동일한 KFold(shuffle=True,5-fold,seed=42) 분할을 미리 적용해 각 fold를 자기 fold 제외 나머지 4개로만 집계(add_pitcher_count_lean_kfold, kf.split()은 데이터값이 아니라 행개수/순서에만 의존해 fold배정 일치 보장), (2) X_val(2024 홀드아웃, 모델이 절대 안 보는 행)은 season<=2023(=X_train 원본행)만으로 만든 정적 lookup 병합(add_pitcher_count_lean_static, TK_LOOKUP_VAL과 동일 원칙). 두 경로 모두 셀 비율을 그 행의 pitcher_success_rate_smooth로 재수축(k=30, 2단계 계층: global_mean<-투수전체평균<-투수x카운트셀). 버킷은 (pitcher_id,balls_before,strikes_before) 채택 -- outs_before까지 3중 키는 중앙값 21행/30퍼센트가 10행 미만으로 과다분할, 2중 키는 season<=2023 기준 중앙값49/평균147.5행(10행미만 21.9퍼센트)으로 표준볼카운트(12종) 단위라 적절. 독립 진단 스크립트(docs/pitcher_count_lean_unbiased_gate_diagnostic.py, main eea05e5/v8-li 기준 build_features() 문자단위 재현)로 이중게이트 실행(LGB+CB 재적합 + 5-fold KFold OOF, 총 22.9분). (A)기존방식(2024 홀드아웃 직접 최댓값): without 774.07(calibrate_then_blend/w=0.45) vs with 757.25(calibrate_then_blend/w=0.55) -- diff -16.81. (B)독립게이트(가중치는 OOF 원시 블렌드 Brier로만 선택, order=blend_then_calibrate 고정, 2024는 평가전용): without 761.61(w=0.75) vs with 744.49(w=0.90) -- diff -17.12. 두 게이트 모두 뚜렷한 음수이고 크기도 비슷(-16.81/-17.12) -- season워크로드 사례((A)+14.61인데 (B)+0.94로 소멸)와 다른 패턴으로, (A)조차 이미 음수라 "홀드아웃 과적합" 설명이 아니라 두 게이트가 서로를 검증하는 모양. 리크 의심 기준("(A) 큰 양수 + (B) 작거나 음수")에도 해당 안 됨 -- 리크는 보통 낙관적으로 부풀리는데 여기선 두 갈래 다 일관되게 나쁨. solo 점수도 둘 다 하락(LGB 720.59->714.63(-5.96), CB 740.89->707.01(-33.88, 심각)). LGB 피처중요도로는 pitcher_count_lean이 86개 중 2위(raw=417)로 매우 높은데도 홀드아웃은 악화 -> 모델이 이 피처에 강하게 의존하도록 학습되지만 일반화 실패. 원인은 리크보다는 fold분할로 더 줄어든 셀 표본(중앙값~40행/셀)에서 특히 CatBoost가 노이즈에 가까운 신호에 과의존하도록 유도됐을 가능성(원인 확정은 범위 밖). 결론: 기각 확정. same_hand(v5)/v8-nn/v9-middle-trend/v9-reverse-rate 전례와 동일 규율로 코드를 build_features() 3파일(train.ipynb/inference.ipynb/script.py) 어디에도 반영하지 않음(main과 문자단위 동일, diff로 확인) -- 진단 스크립트 단계에서 걸러져 노트북 재실행/제출 zip 빌드/Dacon 제출 자체가 불필요했음. README.md에 "v9" 절 + 실험이력 표 행 추가, CLAUDE.md에 기각 요약 추가, docs/pitcher_count_lean_unbiased_gate_diagnostic.py 커밋, 브랜치 push, PR 없음(머지할 코드가 없음).
v10-venn-abers실험	774.07(isotonic,w=0.45,calibrate_then_blend)/773.98(venn_abers,같은 w/order,-0.09)/770.60(isotonic,blend_then_calibrate)/770.92(venn_abers,같은 w/order,+0.32)		discard	experiment/v10-venn-abers-calibration: 2026-01 arXiv 벤치마크(arXiv:2601.19944, TabArena-v0.1)가 isotonic/Platt이 강력한 tabular 모델에서 proper scoring을 오히려 악화시킬 수 있다고 지적하며 Venn-Abers가 log-loss 감소폭 1위였다는 근거로, main(eea05e5=v8-li) 기준 IsotonicRegression을 venn_abers.VennAbers(PyPI, MIT 라이선스, v1.5.4)로 직접 교체하는 실험. 피처 변경 없음(v9류와 달리 without/with 이중게이트가 아니라 "같은 (w_lgb,order)에서 보정기만 바꾸면?" 직접 비교). 독립 진단 스크립트(docs/venn_abers_calibration_diagnostic.py, main eea05e5 기준 build_features()/kfold_oof() 문자단위 재현, LGB+CB 재적합+5-fold KFold OOF, 15.3분)로 확인. isotonic idxmax(main과 동일 절차) 재현이 774.07로 기존 확정치와 정확히 일치해 스크립트 정확성 확인. Venn-Abers idxmax 최댓값 773.98(order=calibrate_then_blend, w=0.45 — 선택된 조합 자체는 isotonic과 동일)로 사실상 동점. apples-to-apples(w_lgb=0.45 고정, main/li 실측 확정값): blend_then_calibrate에서 isotonic 770.60 vs venn_abers 770.92(+0.32), calibrate_then_blend에서 isotonic 774.07 vs venn_abers 773.98(-0.09) — 두 순서 다 ±0.3점대로 이 프로젝트의 최소 신호 크기(same_hand -1.41, li +8.03)보다 한 자릿수 이상 작은 노이즈 수준. 병리적 붕괴 여부도 확인: Venn-Abers 예측값 고유개수가 isotonic보다 오히려 더 많음(calibrate_then_blend에서 unique 3445~3472 vs 2663~2691) — 확률이 소수 구간으로 뭉개지는 문제 없음, [0,1] 범위/분포 정상. Venn-Abers 사용법 노트: venn_abers.VennAbers.fit(p_cal,y_cal)/predict_proba(p_test)는 (n,2) 형태([1-p,p])를 기대하고 predict_proba는 (p_prime,p0_p1) 반환 — p0_p1은 논문(Vovk et al. 2015) Section 4의 멀티확률 구간, p_prime[:,1]이 이미 패키지가 p1/(1-p0+p1) 공식으로 합친 단일 점확률이라 그대로 사용. IsotonicRegression(out_of_bounds="clip")과 동일한 fit(scores_1d,y)/predict(scores_1d) 인터페이스로 감싼 얇은 어댑터(VennAbersScoreCalibrator)로 기존 보정 자리에 그대로 꽂을 수 있게 구현, joblib.dump 피클링도 별도 확인(클로저/람다 없이 numpy 배열만 보유 — 문제없이 picklable, 실제 아티팩트 저장은 기각으로 인해 미실시). 결론: 기각 확정. notebooks/train.ipynb, notebooks/inference.ipynb, src/script.py, src/requirements.txt 전부 main과 문자단위 동일(diff 없음, 애초에 진단 스크립트만 작성했고 노트북은 손대지 않았음). README.md에 "v10" 절 + 실험이력 표 행 추가, CLAUDE.md에 기각 요약 추가, docs/venn_abers_calibration_diagnostic.py + 결과 CSV 커밋, 브랜치 push, PR 없음(머지할 코드가 없음).
8791eb5	774.07(기존W_GRID재현)/770.21(로지스틱스태킹+isotonic,기각)/782.47(로지스틱스태킹,raw,채택)	904.9288858132	keep(PR#12 merged)	v10-logistic-stacking: main(eea05e5=v8-li) 기준, 결합 단계(섹션 6/7)를 W_GRID(0.10~0.90,17개)x보정순서(2개)=34개 조합 홀드아웃 직접 idxmax() 격자탐색+isotonic 보정 블렌드에서 LightGBM/CatBoost KFold OOF 예측 2개를 피처로 하는 sklearn.linear_model.LogisticRegression 메타러너(스태킹)로 교체. 오늘 리서치(스태킹 안전성, scikit-learn StackingClassifier 문서+arXiv:2605.18696) 근거: (1) 메타러너는 반드시 OOF(in-sample 아닌) 예측으로 학습해야 하는데 kfold_oof()가 정확히 그 조건을 만족, (2) 피처 2개뿐인 선형 메타러너는 표현력이 낮아(비음수/합=1 제약 없는 가중블렌드의 일반화판) 과적합 위험이 낮다고 판단해 calibration에 쓰는 OOF를 메타러너 학습에도 재사용(별도 중첩 KFold 없음 — GBM 등 고용량 메타러너였다면 판단이 달랐을 것), (3) "선형 스태킹은 베이스보다 날카로운 출력을 내 보정을 해칠 수 있다"는 가설을 검증하려 raw/isotonic-on-top 둘 다 실험. 독립 진단 스크립트(docs/logistic_stack_diagnostic.py, main eea05e5 기준 train.ipynb 섹션1~6 문자단위 재현, LGB+CB재적합+5-fold KFold OOF, 14.4분)로 2024 홀드아웃 3갈래 비교: 기존(W_GRID+isotonic, 재현) 774.07 vs 로지스틱스태킹 raw 782.47(+8.40) vs 로지스틱스태킹+isotonic추가 770.21(-3.86, 기존보다도 낮음). raw가 가장 좋았고 isotonic을 더 얹으면 오히려 악화되는 역설이 실측됨(가설 arXiv:2605.18696과 일치하는 방향) — li(+8.03)와 비슷한 크기의 뚜렷한 양의 신호로 raw 스태킹 채택. 메타러너 계수 coef=[2.327,2.272]/intercept=-2.313(검증)·coef=[2.300,2.255]/intercept=-2.287(전체데이터)로 극단적이지 않고 대칭에 가까움(기존 W_GRID가 고른 w_lgb=0.45와 방향 일치). 채택 결정에 따라 notebooks/train.ipynb 섹션6/7, notebooks/inference.ipynb, src/script.py 3곳 모두 반영 — 아티팩트 스키마가 blend_w_lgb/calibration_mode/calibrator/calibrator_lgb/calibrator_cb에서 stack_model(fitted LogisticRegression) 단일 키로 교체됨(clean redesign, 구 키 전부 제거). 전체 재학습 재현: 검증 782.47 그대로 재현(메타러너 계수 거의 동일), 5행+245,789행(부트스트랩 리샘플 스트레스, 3.1초, 10분 예산 내) 스모크테스트 통과, zip 압축해제 후 flat 레이아웃(./model,./data,./output)에서도 동일 5행 결과 재현 확인. submissions/v10_logistic_stack.zip(22자, 30자 제한 이내) 빌드 완료. 참고: predict_proba 호출 시 RuntimeWarning(divide by zero/overflow/invalid value encountered in matmul)이 fit/predict 양쪽에서 반복 관찰됐으나, p_lgb/p_cb/최종 예측값 모두 finite/[0,1]범위 확인(NaN 0건, 범위이탈 0건) — 이 Mac의 Apple Accelerate BLAS 백엔드에서 흔히 보고되는 벤치마크성 스퓨리어스 경고로 판단(numpy 커뮤니티에 알려진 이슈), 실제 계산 결과에는 영향 없음을 직접 검증. 로컬 개선이 실제 리더보드에서 반대로 나타난 전례(이슈#4/v4~v6, v8-season)가 이미 여러 번 있으므로 이번 로컬 개선(+8.40)도 강한 정황 증거로만 받아들이고 Dacon 재제출 실측 점수 확인 전까지는 머지하지 않는다. README.md에 "v10" 절 + 실험이력 표 행 추가, CLAUDE.md "Current pipeline" 절 갱신(stack_model 스키마 반영), 브랜치 push, PR 오픈 예정(머지는 실측 확인 후).
 [실측반영 2026-08-25] Dacon 제출: 904.9288858132 — li(895.44) 대비 +9.49, 로컬 예측(+8.40)과 방향·크기 거의 일치(로컬-실측 완전 정합, li 때와 같은 신뢰할 만한 패턴). 이 프로젝트 역대 최고 실측 점수. PR #12 merge 완료(merge commit 440744f), main이 로지스틱회귀 스태킹(stack_model 스키마) 기준으로 전환됨. 같은 날 함께 실측한 v9-oof-default-weight(가중치선택 방식 변경, -16.28로 기각)와 대비되는 결과가 흥미로운 시사점을 준다: PR#11처럼 "OOF에서 격자탐색으로 가중치 선택"은 실패했지만, 이 스태킹은 격자탐색이 아니라 로지스틱회귀 MLE로 OOF에 직접 적합(2-way raw/isotonic-on-top 비교만 홀드아웃에서 함, 34-way 격자탐색 아님)한 것이 성공 요인으로 보임 — "OOF-only 선택" 자체가 만능이 아니라, 선택 메커니즘의 성격(넓은 격자탐색 vs 저용량 모델의 원칙적 적합)이 더 중요하다는 교훈으로 기록.
