commit	local_score	dacon_score	status	description
v11-id-categorical실험	782.47(without,ID=숫자,재현)/599.31(with,ID=범주형)		discard	experiment/v11-id-categorical: pitcher_id/batter_id/pitcher_team_id/batter_team_id(카디널리티 792/830/13/13, 익명화 ID 코드) 4개를 기존 CAT_COLS([top_bottom,game_type,base_state])와 동일 패턴(LightGBM .astype("category")/CatBoost .astype(str)+cat_idx 확장)으로 범주형 전환 시도 — build_features()는 무수정, 기존 원본 컬럼 dtype/처리방식만 변경. 독립 진단 스크립트(docs/id_categorical_diagnostic.py, main 440744f=v10 로지스틱스태킹 기준 train.ipynb 섹션1~6 문자단위 재현)로 실제 전체 train.csv(1,475,092행)를 without/with 각각 재학습(LGB+CB 재적합+5-fold KFold OOF, 총 17.4분)해 2024 홀드아웃 비교. without 재현치(LGB 720.59/CB 740.89/스태킹 782.47)가 v10 실측 확정 수치와 정확히 일치해 스크립트 정확성 확인. with는 세 지표 모두 큰 폭 악화: LGB 단독 720.59->294.38(절반 이하 붕괴), CB 단독 740.89->669.18, 로지스틱스태킹(raw) 782.47->599.31(-183.15, 이 프로젝트 역대 최대 음수 ablation). LightGBM best_iteration도 164->119로 줄어 early stopping이 과적합을 일찍 감지했지만 그 체크포인트조차 훨씬 나빴음. 가설(원인확정 범위밖): ID를 범주형으로 노출하면 모델이 "이 선수 ID의 2019~2023 평균 성공률"을 암기하는 지름길이 생기고, 이는 시간이 지난 2024 홀드아웃에 잘 일반화되지 않음 — 숫자형 유지시 임계값 분기만 가능해 이런 암기가 어려움. unseen-category(훈련 어휘에 없는 ID) 처리는 두 라이브러리 모두 크래시 없이 정상 동작 확인(LightGBM: unseen이 코드 -1(=결측)로 재매핑, 명시적 NaN 대입시와 예측이 최대절대오차 0.0으로 완전 일치 직접검증; CatBoost: 서로 다른 unseen 문자열 4종 모두 예측이 완전히 동일 — 값과 무관한 고정 prior로 대체되는 것으로 보임 직접검증) — 결정에는 영향 없었으나 검증 항목이라 기록. 결론: 기각 확정, Dacon 재제출 불필요할 만큼 명확한 음수. build_features()/CAT_COLS를 notebooks/train.ipynb, notebooks/inference.ipynb, src/script.py 어디에도 반영하지 않음(진단 스크립트만 작성, 노트북/스크립트는 main과 문자단위 동일, diff 없음). README.md에 "v11" 절 추가, CLAUDE.md에 기각 요약 추가, docs/id_categorical_diagnostic.py 커밋, 브랜치 push, PR 없음(머지할 코드가 없음, v9류/v10-venn-abers 전례와 동일 규율).
v12-shap-prune실험	1890.19(38피처,OOF)/1886.66(37피처,OOF)		discard	experiment/v12-shap-pruning: ShapRFECV 스타일 반복 SHAP 가지치기 시도 (docs/shap_prune_diagnostic.py, main 440744f=v10-stack 기준 재현). kfold_oof()의 LightGBM 5-fold 모델에서 native SHAP(pred_contrib, 폴드별 OOF 5만행 샘플)로 38개 파생 피처 중요도를 뽑아 최하위부터 하나씩 제거, 2024 홀드아웃은 전혀 안 보고 OOF 자체에 로지스틱 스태킹을 채점(OOF Brier)해 지금까지 최고 기록보다 떨어지는 첫 지점에서 멈추는 순차적 정지 규칙 사용(v8-nn/season-workload의 "홀드아웃 직접 격자탐색 과적합" 교훈 반영, 그리드서치 argmax 아님). 결과: baseline(38피처) OOF score 1890.19 -> 최하위 SHAP 피처 pitcher_cold_start(|shap|≈0) 제거 시 1886.66으로 첫 시도부터 즉시 악화(-3.53) -> 제거 0개로 종료, 최종 부분집합이 기존 38피처 그대로라 홀드아웃 재확인도 불필요(기존 782.47과 동일). 해석: 트리 기반 SHAP 중요도가 거의 0인 피처도 전체 파이프라인(특히 CatBoost+로지스틱 스태킹) 관점에서는 여전히 기여하고 있었던 것으로 보임 -> ING뱅크 사례(110->60개, AUC 소폭 개선)와 달리 이 프로젝트의 38개 피처는 이미 개별 ablation 게이트를 통과한 것만 남아 있어 잉여 중복이 없었던 것으로 추정. build_features()/FEATURES/ALL_FEATURES 무변경(train.ipynb/inference.ipynb/script.py 세 곳 모두 diff 없음), 진단 스크립트는 재현용으로 보존. README.md "v12" 절 + CLAUDE.md 한 단락 추가, docs-only 커밋 push, PR 없음(머지할 코드가 없음, v9-middle-trend 전례와 동일 규율).
v12-seedbag	782.47(단일시드42재현)/780.32(시드배깅3개,-2.14)		discard	experiment/v12-seed-bagging: main(440744f=v10 로지스틱스태킹) 기준, 오늘 리서치(RESEARCH/trackman_teacher_ensemble_20260825_004206/outputs/02_brier_objective_seedbag.md "시드 앙상블/배깅" 절, AutoGluon 프로덕션 스태킹 설계 Erickson et al. 2020 arXiv:2003.06505 근거)가 제안한 kfold_oof() 시드배깅 시도 — "최종 블렌드만 시드평균하는 게 아니라 kfold_oof() 단계 자체를 여러 시드로 반복해서 그 OOF 예측(lgb_oof/cb_oof)을 메타러너에 들어가기 전에 평균"하는 설계. SEEDS=[42,43,44](3개) 채택 — kfold_oof()에 seed 인자를 추가해 KFold 분할 random_state뿐 아니라 LGB/CB 모델 자신의 random_state도 함께 결정하도록 일반화(v10까지는 분할만 바뀌고 모델은 LGB_PARAMS/CB_PARAMS에 박힌 42로 고정 — "패스 전체를 반복"하려면 둘 다 바뀌어야 함), seed_bagged_oof()가 SEEDS 각각으로 kfold_oof() 전체를 반복해 lgb_oof/cb_oof를 시드 평균한 뒤 로지스틱 회귀 메타러너 재학습. 스태킹 입력으로 실제 배포될 예측(섹션 7 최종 베이스러너)도 SEEDS 개수만큼 학습해 predict_proba를 평균하는 방식으로 통일 — 검증단계(섹션4/5)의 val_pred_lgb/val_pred_cb도 동일하게 시드평균해 홀드아웃 점수가 end-to-end로 정직하도록 설계. 독립 진단 스크립트(docs/seed_bag_diagnostic.py, main 440744f 기준 train.ipynb 섹션1~6 문자단위 재현)로 2024 홀드아웃 검증(검증단계만 36회 모델학습, 55.0분 소요): (A)단일시드(42) 재현 OOF brier=0.244083(score=1975.62), 홀드아웃 782.47 — v10 실측 확정치와 정확히 일치해 스크립트 정확성 확인. (B)시드배깅(3개) OOF brier=0.244071(score=1980.55), 홀드아웃 780.32 — diff -2.14. OOF 자체는 개선(+4.93)됐는데 홀드아웃은 반대방향으로 악화 — v9-oof-default-weight(PR#11)에서 이미 확인된 "OOF 신호와 실제 일반화 방향이 항상 일치하지 않는다"는 패턴 재현. 크기는 same_hand(v5, -1.41) 수준의 노이즈로 리크/버그 신호는 아님 — 가설: 이 파이프라인 베이스모델(5-fold, subsample=0.8)이 이미 충분히 안정적이라 시드배깅으로 줄일 노이즈 자체가 크지 않았을 가능성(원인 확정은 범위 밖). 결론: 기각 확정. same_hand(v5)/v9류/v11 전례와 동일 규율로 코드를 notebooks/train.ipynb, notebooks/inference.ipynb, src/script.py 어디에도 반영하지 않음(진단 스크립트 단계에서 걸러져 전체데이터 재학습/제출zip빌드/추론시간 스트레스테스트 자체가 불필요했음). README.md에 "v12" 절 + 실험이력 표 행 추가, CLAUDE.md에 기각 요약 추가, docs/seed_bag_diagnostic.py 커밋, 브랜치 push, PR 없음(머지할 코드가 없음, v9류/v11 전례와 동일 규율).
v12-recency-weight실험	1975.62(none,OOF)/1974.48(H8,OOF)/1977.61(H4,OOF,1위)/1961.00(H2,OOF)/1900.29(H1,OOF) -> 782.47(기준,홀드아웃)/772.64(H4,홀드아웃,-9.83)		discard	experiment/v12-recency-weight: main(440744f=v10 로지스틱스태킹) 기준, 피처 변경 없음. LightGBM/CatBoost 학습에 지수감쇠 최신성 sample weight d(t)=2^(-age/H)(Yan et al. 2018, arXiv:1806.08211; age=기준시즌(2024)으로부터의 시즌거리) 도입 시도 — RESEARCH/trackman_teacher_ensemble_20260825_004206/outputs/01_recency_shap.md "최신성 가중 학습" 절 근거. 데이터가 2019~2024 6개 시즌뿐이라 decay가 세지면 N_eff=(Σw)²/Σw²가 붕괴할 위험이 가장 큰 후보로 사전 지목됨. gotcha 대응: (1) min_sum_hessian_in_leaf는 가중 hessian합 기준이라 재탐색 필요할 수 있으나 기본값(1e-3)이 원래도 non-binding이라 그대로 둠(학습실패/비정상 얕은 트리 등 증상 없음 확인, 채택됐다면 half-life별 재스윕 필요했을 파라미터). (2) LightGBM GH이슈#4551(eval_set도 가중 필요) 반영해 eval_sample_weight= 명시(단 2024 홀드아웃 평가지표 자체는 unweighted 유지 — 실제 미래시즌 예측 모사가 목적). 방법론(이중절차): 1차 half-life 5개(없음/8/4/2/1시즌)를 kfold_oof() 가중학습 확장판으로 OOF신호(로지스틱스태킹 in-sample Brier)만으로 비교(2024 홀드아웃 미사용) — 없음 1975.62/H8 1974.48/H4 1977.61(1위)/H2 1961.00/H1 1900.29. H1/H2는 N_eff가 56.71%/81.74%까지 붕괴하며 뚜렷하게 나빠짐(사전우려 실측 확인). 없음/8/4는 1974~1978 구간(차이 3.13점, ~0.16%)으로 근소하나 H4가 1위. 2차: H4 단 1개만 골라 2024 홀드아웃 1회 확인(가중 early stopping + 가중 kfold_oof 재학습 + 스태킹) — best_iteration LGB 126/CB 288(참고: 무가중 164/436), LGB단독 705.70(무가중720.59), CB단독 728.55(무가중740.89), 최종(로지스틱스태킹,raw) 772.64 vs 기준 782.47 = -9.83. li(+8.03)/스태킹(+8.40) 채택 당시와 비슷한 크기의 신호이나 부호 반대, 두 베이스모델 모두 하락(한쪽만의 문제 아님). 결론: 기각 확정. notebooks/train.ipynb, notebooks/inference.ipynb, src/script.py 전부 main과 문자단위 동일(diff 없음, sample_weight는 학습전용 개념이라 build_features()/추론경로는 애초에 무관 — 검증 완료). docs/recency_weight_diagnostic.py 커밋(그리드서치+H4확인 로직 재현, 총 실행시간 약 68분: 그리드서치 63분+H4확인 5분), README.md에 "v12" 절 + 실험이력 표 행 추가, CLAUDE.md에 기각 요약 추가, 브랜치 push, PR 없음(머지할 코드가 없음, v9류/v10-venn-abers/v11-id-categorical 전례와 동일 규율).
v13-hand-count-tk실험	774.35(without,홀드아웃)/736.15(with,홀드아웃)/1979.91(without,OOF)/1959.75(with,OOF)		discard	experiment/v13-hand-count-tk: build_features()에 (pitcher_hand, batter_hand, balls_before, strikes_before, outs_before) 5-key trackman lookup(7개 피처) 추가 시도 — docs/v13_hand_count_tk_diagnostic.py. 이중게이트 결과: (A) 홀드아웃 774.35 -> 736.15 (-38.20), (B) OOF score 1979.91 -> 1959.75 (-20.15). 두 게이트 및 베이스모델(LGB 720.59->709.52, CB 740.89->725.26) 모두 일관되게 큰 폭 악화. v5의 same_hand 4-key lookup 실패(-1.41)와 동일한 메커니즘으로, 셀당 표본이 181개로 세분화되면서 신호보다 노이즈가 급증한 것으로 분석됨. 결론: 기각 확정.
v14-season-decomposition	836.35(with,홀드아웃)/2009.23(with,OOF)	976.5066998354	keep	experiment/v14-season-decomposition: build_features()에 SeasonDecompositionEncoder(R18 스타일 베이지안 당해 시즌 분해, 16개 피처) 추가 — docs/v14_season_decomposition_diagnostic.py. 이중게이트 결과: (A) 2024 홀드아웃 774.35 -> 836.35 (+62.01), (B) OOF score 1979.91 -> 2009.23 (+29.32). 베이스모델 단독: LightGBM 720.59 -> 809.27 (+88.68), CatBoost 740.89 -> 840.81 (+99.92). Dacon 실측 점수 976.5066998354 (v10 904.93 대비 +71.58 대폭 개선, 프로젝트 역대 최고 점수 경신). 과거 시즌에서 동결된 선수별 누적치(history_n, history_success)를 바탕으로 당해 시즌 투구 수 및 성공 수를 무누수로 복원하고 베이지안 사후확률(alpha=50.0)을 유도함으로써, 커리어 평균에 희석되었던 당해 시즌 폼(breakout/slump) 신호를 격리하여 극적인 성능 향상 달성. 채택 확정.
v15-matchup-interaction실험	836.35(without,홀드아웃)/819.62(with,홀드아웃)/2009.23(without,OOF)/2024.59(with,OOF)		discard	experiment/v15-matchup-interaction: build_features()에 당해 시즌 폼 기반 매치업 2개(matchup_current_posterior_diff, matchup_current_gap_diff) 및 레버리지/카운트 상호작용 5개(총 7개 피처) 추가 시도 — docs/v15_current_matchup_interactions_diagnostic.py. 이중게이트 결과: (A) 2024 홀드아웃 836.35 -> 819.62 (-16.74), (B) OOF score 2009.23 -> 2024.59 (+15.36). 베이스모델 분기: LightGBM solo는 809.27 -> 819.53 (+10.26)으로 개선되었으나 CatBoost solo가 840.81 -> 827.06 (-13.75)으로 하락. 대칭 트리 구조의 CatBoost가 연속형 곱셈 상호작용(*li, *count)의 다중공선성에 민감하게 반응하여 분할 효율이 저하된 것으로 분석됨. (A) 홀드아웃 하락으로 인한 실측 역전 위험을 방지하기 위해 v15 패키지 기각 확정.
v16-hgb-stacking실험	836.35(2way,홀드아웃)/662.01(3way,홀드아웃)/2009.23(2way,OOF)/2149.38(3way,OOF)		discard	experiment/v16-hgb-stacking: v14 피처셋 기반 HistGradientBoosting(HGB) 추가 3-way 스태킹(LGB+CB+HGB) 시도 — docs/v16_hgb_stacking_diagnostic.py. 이중게이트 결과: (A) 2024 홀드아웃 836.35 -> 662.01 (-174.34, 대폭 붕괴), (B) OOF score 2009.23 -> 2149.38 (+140.16). HGB 단독 성능(648.38)이 LGB(809.27)/CB(840.81)에 비해 크게 열세인 상태에서 3개 고상관 예측을 로지스틱 회귀 메타러너에 입력하자 음수 가중치(CB coef=-0.1351) 및 OOF 내 과적합이 발생. OOF 점수는 급상승했으나 2024 홀드아웃이 662점으로 붕괴되어 Phase2에서 확인된 메타러너 과적합 병리 재현. 기각 확정.
v17-alpha-sweep실험	836.35(alpha=50.0,1위)/808.61(alpha=20)/804.02(alpha=35)/818.66(alpha=75)/810.88(alpha=100)		keep(alpha=50.0유지)	experiment/v17-alpha-sweep: Season Decomposition 베이지안 수축 계수 alpha in [20, 35, 50, 75, 100] 전수 스윕 — docs/v17_alpha_sweep_diagnostic.py. 홀드아웃 결과: alpha=20(808.61), alpha=35(804.02), alpha=50(836.35, 압도적 1위), alpha=75(818.66), alpha=100(810.88). alpha=50.0이 2024 홀드아웃과 OOF의 최적 균형점임을 재확인. v14의 alpha=50.0 기본값 유지 확정.
v18-soft-distillation실험	836.35(without,v14)/846.75(with,w=0.45)/844.19(with,3way-ridge)/2009.23(without,OOF)/2008.71(with,3way-OOF)	658.740547027	discard	experiment/v18-soft-distillation: Phase2 R35 스타일 Multi-Teacher Soft Label Consensus Distillation 도입 — docs/v18_soft_distillation_diagnostic.py, docs/v18_ensemble_distillation_diagnostic.py. LightGBM과 CatBoost 5-fold OOF 평균(p_teacher)으로 부드러운 소프트 타겟 y_soft=(1-w)*y + w*p_teacher 생성 후 Student LightGBM 학습. Dacon 실측 점수 658.740547027 (v14 976.51 대비 -317.77점 대폭 하락). 원인 분석: (1) Gate (B) OOF 점수가 2009.23 -> 2008.71 / 1991.48로 이미 음수였음에도 홀드아웃 점수만 보고 진행한 결과 실측 역전 발생. (2) Soft Target으로 수축된 Student 모델과 Hard LGB, Hard CB 3개의 초고상관 예측이 로지스틱 회귀 메타러너에 들어가면서 총 가중치 합이 4.52로 커져 테스트셋 예측 확률의 양 극단(tails)이 과도하게 벌어짐(min 0.30, max 0.80). 2차 손실인 Brier Score에서 잘못된 극단 확신이 치명타로 작용. 결론: 기각 확정, src/script.py는 v14 기준선으로 즉시 롤백.
v19-count-conditioned-prior실험	836.35(without,홀드아웃)/811.49(with,홀드아웃)/2009.23(without,OOF)/2020.20(with,OOF)		discard	experiment/v19-count-conditioned-prior: xCTRL 스타일 볼카운트별 기대 제구율 4개 피처(count_expected_control, pitcher_control_over_expected, batter_control_over_expected, matchup_xctrl_diff) 추가 시도 — docs/v19_count_conditioned_prior_diagnostic.py. 이중게이트 결과: (A) 2024 홀드아웃 836.35 -> 811.49 (-24.87), (B) OOF score 2009.23 -> 2020.20 (+10.97). 단독 모델(LGB 809.27->810.25, CB 840.81->843.65)은 소폭 올랐으나, 볼카운트별 제구율 변동폭(0.508~0.541)이 좁아 기존 볼카운트 피처와 중복성을 띠며 스태킹 메타러너에서 홀드아웃 점수가 하락. (A) 하락에 따른 실측 역전 방지를 위해 기각 확정.
v20-trackman-physics-dev실험	836.35(without,홀드아웃)/831.48(with,홀드아웃)/2009.23(without,OOF)/2016.69(with,OOF)		discard	experiment/v20-trackman-physics-dev: Trackman 3-key 리그 물리 지표 5개(tk_bauer_units, tk_speed_loss_ratio, tk_movement_dispersion, tk_rel_height_mean, tk_rel_side_mean) 추가 시도 — docs/v20_trackman_physics_diagnostic.py. 이중게이트 결과: (A) 2024 홀드아웃 836.35 -> 831.48 (-4.88), (B) OOF score 2009.23 -> 2016.69 (+7.46). LightGBM solo는 809.27 -> 818.52 (+9.25)로 크게 상승했으나, CatBoost solo가 840.81 -> 825.79 (-15.02)로 하락. 대칭 트리(oblivious table) 구조의 CatBoost가 원시 물리값과 파생 비율 간의 동시 분할에서 트리 깊이 예산을 낭비하여 성능이 저하된 것으로 분석됨. (A) 하락에 따른 안전 원칙으로 기각 확정.
v21-pitchmix-middle-decomp실험	836.35(without,홀드아웃)/827.10(with,홀드아웃)/2009.23(without,OOF)/2011.79(with,OOF)		discard	experiment/v21-pitchmix-middle-decomp: 투수의 구종 레퍼토리 구사율(fastball, breaking, offspeed) 및 실투율(middle_rate) 시즌 분해 11개 피처 추가 시도 — docs/v21_pitchmix_middle_decomposition_diagnostic.py. 이중게이트 결과: (A) 2024 홀드아웃 836.35 -> 827.10 (-9.26), (B) OOF score 2009.23 -> 2011.79 (+2.56). 단독 모델(LGB 809.27->808.76, CB 840.81->836.79) 모두 하락. 타겟과 직결되지 않는 간접 공변량의 사후확률 11개가 추가되면서 차원이 팽창하고 트리의 핵심 분할 예산이 희석된 것으로 분석됨. (A) 하락에 따른 안전 원칙으로 기각 확정.
v22-cb-reg5실험	836.35(기준)/833.63(reg=5.0)/2009.23(기준)/2009.10(OOF)		discard	experiment/v22-cb-reg5: CatBoost l2_leaf_reg=5.0 정규화 강화 시도 — docs/autoresearch_runner.py. 이중게이트 결과: (A) 홀드아웃 836.35 -> 833.63 (-2.72), (B) OOF score 2009.23 -> 2009.10 (-0.13). 정규화 과다로 인한 트리 분할 성능 저하. 기각 확정.
v23-meta-ridge실험	836.35(기준)/846.92(ridge)/2009.23(기준)/2008.18(OOF)		discard	experiment/v23-meta-ridge: LogisticRegression(C=0.1) Ridge 메타러너 규제 시도 — docs/autoresearch_runner.py. 이중게이트 결과: (A) 홀드아웃 836.35 -> 846.92 (+10.57), (B) OOF score 2009.23 -> 2008.18 (-1.05). Gate (B) 음수로 실측 역전 위험 방지를 위해 기각 확정.
v24-career-smooth-k50	846.83(with,홀드아웃)/2016.06(with,OOF)	538.9344809598	discard	experiment/v24-career-smooth-k50: 투수 및 타자 커리어 성공률 베이지안 스무딩 계수 k를 기존 30에서 k=50으로 변경 — docs/v24_k_sweep_diagnostic.py. Dacon 실측 점수 538.9344809598 (v14 976.51 대비 -437.57 폭락). 원인 분석: (1) k=50으로 변경 시 LightGBM의 OOF 예측이 CatBoost를 압도하면서 메타러너 계수가 LGB=4.4884, CB=0.0079로 극단적 단일 모델 쏠림 발생. (2) 2025 평가셋 추론 시 앙상블의 상쇄 완충 효과가 사라지고 LGB 단독의 과도한 기울기 증폭으로 예측 확률이 극단(min 0.299, max 0.819)으로 벌어짐. 2차 손실인 Brier Score에서 오예측 페널티가 제곱으로 폭증하여 점수 급락. 결론: 기각 확정, src/script.py는 k=30(v14 976.51 기준선)으로 즉시 롤백.
v25-pure-matchup-diff실험	836.35(기준)/799.77(with)/2009.23(기준)/2009.87(OOF)		discard	experiment/v25-pure-matchup-diff: matchup_current_posterior_diff 1개 피처 단독 추가 시도 — docs/autoresearch_runner.py. 이중게이트 결과: (A) 홀드아웃 836.35 -> 799.77 (-36.58). 트리 분할 교란으로 홀드아웃 급락. 기각 확정.
v26-late-close-mod실험	836.35(기준)/821.45(with)/2009.23(기준)/2030.32(OOF)		discard	experiment/v26-late-close-mod: late_close_pitcher_smooth 1개 피처 추가 시도 — docs/autoresearch_runner.py. 이중게이트 결과: (A) 홀드아웃 836.35 -> 821.45 (-14.90). 홀드아웃 급락으로 기각 확정.
v27-recency-momentum실험	836.35(기준)/820.09(with)/2009.23(기준)/2014.61(OOF)		discard	experiment/v27-recency-momentum: Sabermetric Location+ 스타일 최근 경기 지수 가중 모멘텀, 제구 변동성, 실투 추세 3개 피처 추가 — docs/v27_to_v30_autonomous_runner.py. 이중게이트 결과: (A) 홀드아웃 836.35 -> 820.09 (-16.26), (B) OOF score 2009.23 -> 2014.61 (+5.38). 메타러너 계수: LGB=4.89, CB=-0.41 (CatBoost 음수 가중치 붕괴 발생). 5대 하드 가드레일(Ensemble Balance Fail)에 의해 기각 확정.
v28-hierarchical-team-prior실험	836.35(기준)/826.57(with)/2009.23(기준)/2006.99(OOF)		discard	experiment/v28-hierarchical-team-prior: Empirical Bayes 계층적 팀 베이스라인 2개 피처 추가 — docs/v27_to_v30_autonomous_runner.py. 이중게이트 결과: (A) 홀드아웃 836.35 -> 826.57 (-9.78), (B) OOF score 2009.23 -> 2006.99 (-2.24). 메타러너 계수: LGB=4.72, CB=-0.23 (CatBoost 음수 가중치 붕괴). 이중 게이트 음수 및 가드레일 실패로 기각 확정.
v29-platoon-trackman-dev실험	836.35(기준)/829.97(with)/2009.23(기준)/2009.03(OOF)		discard	experiment/v29-platoon-trackman-dev: Platoon Split 4-key Trackman 룩업 2개 피처 추가 — docs/v27_to_v30_autonomous_runner.py. 이중게이트 결과: (A) 홀드아웃 836.35 -> 829.97 (-6.38), (B) OOF score 2009.23 -> 2009.03 (-0.20). 메타러너 계수: LGB=4.42, CB=0.07 (CatBoost 가중치 0.15 미만 붕괴). 가드레일 실패로 기각 확정.
v30-brier-slsqp-metalearner실험	836.35(기준)/829.19(with)/2009.23(기준)/1991.31(OOF)		discard	experiment/v30-brier-slsqp-metalearner: Brier Score (p-y)^2 직접 최소화 SLSQP 유계 메타러너 — docs/v27_to_v30_autonomous_runner.py. 이중게이트 결과: (A) 홀드아웃 836.35 -> 829.19 (-7.16), (B) OOF score 2009.23 -> 1991.31 (-17.92). 메타러너 계수: LGB=3.04, CB=1.04. 가중치 균형은 합격했으나 5-Fold OOF에서 Brier 직접 최적화가 로지스틱 회귀 대비 일반화 성능 하락. 기각 확정.






